{
    "nodes": [
        {
            "line": 0,
            "nodeNumber": 1,
            "column": 1,
            "successors": [
                {
                    "distance": 8.0,
                    "nodeNumber": 2
                },
                {
                    "distance": 3.0,
                    "nodeNumber": 6
                }
            ],
            "type": "D"
        },
        {
            "line": 8,
            "nodeNumber": 2,
            "column": 1,
            "successors": [
                {
                    "distance": 8.0,
                    "nodeNumber": 1
                },
                {
                    "distance": 3.0,
                    "nodeNumber": 7
                },
                {
                    "distance": 8.0,
                    "nodeNumber": 3
                }
            ],
            "type": "D"
        },
        {
            "line": 16,
            "nodeNumber": 3,
            "column": 1,
            "successors": [
                {
                    "distance": 8.0,
                    "nodeNumber": 2
                },
                {
                    "distance": 3.0,
                    "nodeNumber": 8
                },
                {
                    "distance": 8.0,
                    "nodeNumber": 4
                }
            ],
            "type": "D"
        },
        {
            "line": 24,
            "nodeNumber": 4,
            "column": 1,
            "successors": [
                {
                    "distance": 8.0,
                    "nodeNumber": 3
                },
                {
                    "distance": 3.0,
                    "nodeNumber": 9
                },
                {
                    "distance": 8.0,
                    "nodeNumber": 5
                }
            ],
            "type": "D"
        },
        {
            "line": 32,
            "nodeNumber": 5,
            "column": 1,
            "successors": [
                {
                    "distance": 8.0,
                    "nodeNumber": 4
                },
                {
                    "distance": 3.0,
                    "nodeNumber": 10
                }
            ],
            "type": "D"
        },
        {
            "line": 0,
            "nodeNumber": 6,
            "column": 4,
            "successors": [
                {
                    "distance": 3.0,
                    "nodeNumber": 1
                },
                {
                    "distance": 8.0,
                    "nodeNumber": 7
                },
                {
                    "distance": 3.0,
                    "nodeNumber": 11
                }
            ],
            "type": "D"
        },
        {
            "line": 8,
            "nodeNumber": 7,
            "column": 4,
            "successors": [
                {
                    "distance": 8.0,
                    "nodeNumber": 6
                },
                {
                    "distance": 3.0,
                    "nodeNumber": 12
                },
                {
                    "distance": 3.0,
                    "nodeNumber": 2
                },
                {
                    "distance": 8.0,
                    "nodeNumber": 8
                }
            ],
            "type": "D"
        },
        {
            "line": 16,
            "nodeNumber": 8,
            "column": 4,
            "successors": [
                {
                    "distance": 3.0,
                    "nodeNumber": 13
                },
                {
                    "distance": 8.0,
                    "nodeNumber": 9
                },
                {
                    "distance": 3.0,
                    "nodeNumber": 3
                },
                {
                    "distance": 8.0,
                    "nodeNumber": 7
                }
            ],
            "type": "D"
        },
        {
            "line": 24,
            "nodeNumber": 9,
            "column": 4,
            "successors": [
                {
                    "distance": 8.0,
                    "nodeNumber": 8
                },
                {
                    "distance": 3.0,
                    "nodeNumber": 14
                },
                {
                    "distance": 8.0,
                    "nodeNumber": 10
                },
                {
                    "distance": 3.0,
                    "nodeNumber": 4
                }
            ],
            "type": "D"
        },
        {
            "line": 32,
            "nodeNumber": 10,
            "column": 4,
            "successors": [
                {
                    "distance": 8.0,
                    "nodeNumber": 9
                },
                {
                    "distance": 3.0,
                    "nodeNumber": 15
                },
                {
                    "distance": 3.0,
                    "nodeNumber": 5
                }
            ],
            "type": "D"
        },
        {
            "line": 0,
            "nodeNumber": 11,
            "column": 7,
            "successors": [
                {
                    "distance": 3.0,
                    "nodeNumber": 6
                },
                {
                    "distance": 3.0,
                    "nodeNumber": 16
                },
                {
                    "distance": 8.0,
                    "nodeNumber": 12
                }
            ],
            "type": "D"
        },
        {
            "line": 8,
            "nodeNumber": 12,
            "column": 7,
            "successors": [
                {
                    "distance": 8.0,
                    "nodeNumber": 11
                },
                {
                    "distance": 3.0,
                    "nodeNumber": 17
                },
                {
                    "distance": 8.0,
                    "nodeNumber": 13
                },
                {
                    "distance": 3.0,
                    "nodeNumber": 7
                }
            ],
            "type": "D"
        },
        {
            "line": 16,
            "nodeNumber": 13,
            "column": 7,
            "successors": [
                {
                    "distance": 8.0,
                    "nodeNumber": 12
                },
                {
                    "distance": 3.0,
                    "nodeNumber": 18
                },
                {
                    "distance": 3.0,
                    "nodeNumber": 8
                },
                {
                    "distance": 8.0,
                    "nodeNumber": 14
                }
            ],
            "type": "D"
        },
        {
            "line": 24,
            "nodeNumber": 14,
            "column": 7,
            "successors": [
                {
                    "distance": 3.0,
                    "nodeNumber": 19
                },
                {
                    "distance": 8.0,
                    "nodeNumber": 15
                },
                {
                    "distance": 3.0,
                    "nodeNumber": 9
                },
                {
                    "distance": 8.0,
                    "nodeNumber": 13
                }
            ],
            "type": "D"
        },
        {
            "line": 32,
            "nodeNumber": 15,
            "column": 7,
            "successors": [
                {
                    "distance": 8.0,
                    "nodeNumber": 14
                },
                {
                    "distance": 3.0,
                    "nodeNumber": 20
                },
                {
                    "distance": 3.0,
                    "nodeNumber": 10
                }
            ],
            "type": "D"
        },
        {
            "line": 0,
            "nodeNumber": 16,
            "column": 10,
            "successors": [
                {
                    "distance": 3.0,
                    "nodeNumber": 11
                },
                {
                    "distance": 3.0,
                    "nodeNumber": 21
                },
                {
                    "distance": 8.0,
                    "nodeNumber": 17
                }
            ],
            "type": "D"
        },
        {
            "line": 8,
            "nodeNumber": 17,
            "column": 10,
            "successors": [
                {
                    "distance": 8.0,
                    "nodeNumber": 16
                },
                {
                    "distance": 3.0,
                    "nodeNumber": 22
                },
                {
                    "distance": 8.0,
                    "nodeNumber": 18
                },
                {
                    "distance": 3.0,
                    "nodeNumber": 12
                }
            ],
            "type": "D"
        },
        {
            "line": 16,
            "nodeNumber": 18,
            "column": 10,
            "successors": [
                {
                    "distance": 8.0,
                    "nodeNumber": 17
                },
                {
                    "distance": 3.0,
                    "nodeNumber": 23
                },
                {
                    "distance": 8.0,
                    "nodeNumber": 19
                },
                {
                    "distance": 3.0,
                    "nodeNumber": 13
                }
            ],
            "type": "D"
        },
        {
            "line": 24,
            "nodeNumber": 19,
            "column": 10,
            "successors": [
                {
                    "distance": 8.0,
                    "nodeNumber": 18
                },
                {
                    "distance": 3.0,
                    "nodeNumber": 24
                },
                {